{
  "$schema": "http://json-schema.org/draft-07/schema#",
  "title": "Game Design Document v2",
  "description": "A schema for defining a rich, research-informed incremental game, based on the principles from 'The Compounding Illusion' tome.",
  "type": "object",
  "properties": {
    "meta": {
      "type": "object",
      "properties": {
        "gameTitle": { "type": "string" },
        "gameVersion": { "type": "string" }
      },
      "required": ["gameTitle", "gameVersion"]
    },
    "playerExperience": {
      "type": "object",
      "properties": {
        "numberFormatting": { "type": "string", "enum": ["standard", "scientific", "engineering"] },
        "uiDirectives": {
          "type": "object",
          "properties": {
            "showProductionRates": { "type": "boolean" },
            "showEfficiencyScores": { "type": "boolean" },
            "liveSurroundings": { "type": "boolean", "description": "Hint to the UI to have active, animated elements." }
          }
        }
      }
    },
    "coreLoop": {
      "type": "object",
      "properties": {
        "primaryCurrency": {
          "type": "object",
          "properties": {
            "id": { "type": "string" },
            "name": { "type": "string" },
            "initialValue": { "type": "number" }
          },
          "required": ["id", "name", "initialValue"]
        },
        "manualClickValue": {
          "type": "object",
          "properties": {
            "baseValue": { "type": "number" }
          },
          "required": ["baseValue"]
        }
      },
      "required": ["primaryCurrency", "manualClickValue"]
    },
    "generators": {
      "type": "array",
      "items": {
        "type": "object",
        "properties": {
          "id": { "type": "string" },
          "name": { "type": "string" },
          "description": { "type": "string" },
          "baseCost": { "type": "number" },
          "costScaling": { "type": "number", "description": "e.g., 1.15 for a 15% increase" },
          "output": {
            "type": "object",
            "description": "Defines what this generator produces (currency or another generator for derivative growth).",
            "properties": {
              "type": { "type": "string", "enum": ["currency", "generator"] },
              "targetId": { "type": "string" },
              "baseRate": { "type": "number" }
            },
            "required": ["type", "targetId", "baseRate"]
          },
          "milestoneBonuses": {
            "type": "array",
            "description": "Implements 'Shifting Priorities'. Bonuses applied when a certain number of this generator is owned.",
            "items": {
              "type": "object",
              "properties": {
                "level": { "type": "number" },
                "effect": { "$ref": "#/definitions/effect" }
              },
              "required": ["level", "effect"]
            }
          }
        },
        "required": ["id", "name", "baseCost", "costScaling", "output"]
      }
    },
    "upgrades": {
      "type": "array",
      "items": {
        "type": "object",
        "properties": {
          "id": { "type": "string" },
          "name": { "type": "string" },
          "description": { "type": "string" },
          "cost": { "type": "number" },
          "unlockConditions": { "$ref": "#/definitions/unlockConditions" },
          "effect": { "$ref": "#/definitions/effect" }
        },
        "required": ["id", "name", "cost", "unlockConditions", "effect"]
      }
    },
    "prestige": {
      "type": "object",
      "properties": {
        "layers": {
          "type": "array",
          "items": {
            "type": "object",
            "properties": {
              "id": { "type": "string" },
              "currencyName": { "type": "string" },
              "unlockConditions": { "$ref": "#/definitions/unlockConditions" },
              "formula": { "type": "string", "description": "e.g., 'floor(150 * cbrt(currency.insight / 1e9))'" },
              "effect": { "$ref": "#/definitions/effect" }
            },
            "required": ["id", "currencyName", "unlockConditions", "formula", "effect"]
          }
        }
      }
    },
    "paradigmShifts": {
      "type": "array",
      "description": "Major game-altering events that unfold the narrative and complexity.",
      "items": {
        "type": "object",
        "properties": {
          "id": { "type": "string" },
          "unlockConditions": { "$ref": "#/definitions/unlockConditions" },
          "description": { "type": "string", "description": "Narrative text for when the shift occurs." },
          "newMechanicsUnlocked": {
            "type": "array",
            "items": { "type": "string" }
          }
        },
        "required": ["id", "unlockConditions", "description", "newMechanicsUnlocked"]
      }
    },
    "engagementHooks": {
      "type": "object",
      "properties": {
        "offlineProgression": {
          "type": "object",
          "properties": {
            "maxTimeSeconds": { "type": "number" },
            "efficiency": { "type": "number", "description": "e.g., 0.9 for 90% of online rate" }
          }
        },
        "randomRewards": {
          "type": "array",
          "items": {
            "type": "object",
            "properties": {
              "id": { "type": "string" },
              "type": { "type": "string", "enum": ["clickable"] },
              "frequencySeconds": { "type": "number" },
              "effect": { "$ref": "#/definitions/effect" }
            },
            "required": ["id", "type", "frequencySeconds", "effect"]
          }
        }
      }
    },
    "monetization": {
      "type": "object",
      "description": "Defines Player-Friendly Design monetization strategies.",
      "properties": {
        "rewardedAds": {
          "type": "array",
          "items": {
            "type": "object",
            "properties": {
              "id": { "type": "string" },
              "name": { "type": "string" },
              "cooldownSeconds": { "type": "number" },
              "effect": { "$ref": "#/definitions/effect" }
            },
            "required": ["id", "name", "cooldownSeconds", "effect"]
          }
        }
      }
    }
  },
  "required": ["meta", "coreLoop", "generators"],
  "definitions": {
    "unlockConditions": {
      "type": "array",
      "items": {
        "type": "object",
        "properties": {
          "type": { "type": "string", "enum": ["generator_owned", "currency_owned", "upgrade_owned"] },
          "targetId": { "type": "string" },
          "value": { "type": "number" }
        },
        "required": ["type", "targetId", "value"]
      }
    },
    "effect": {
      "type": "object",
      "properties": {
        "type": { "type": "string", "enum": ["multiplier", "additive_bonus"] },
        "targetId": { "type": "string", "description": "ID of the generator, currency, or 'global' to affect." },
        "targetProperty": {"type": "string", "enum": ["production", "clickValue"]},
        "value": { "type": "number", "description": "e.g., 2 for a 2x multiplier or +10 additive bonus." }
      },
      "required": ["type", "targetId", "value"]
    }
  }
}
